tweet;tipo
hace un rato me preguntaban segun usted quien sobra en el planeta creo podria poner a los evangelicos retrogradas en ese grupo esos que cren que dos hombres besandose traeran el fin del mundo ;3
nos fuimos llorando;1
pues cada cumpleanos me regalan un iphone;1
buters una cena en un sotano con un hermanito;1
cuanto tu pata quiere joder lo hace y tu te prestas para la huevada jajaja;2
campeao no lol sendo campeao no futebol ta chato se flamengo ja;1
yo nunca podre;1
la causa r en vargas;1
tradicion ecuatorial comer canas la cana de azucar se la cosecha en gran parte en la region selvatica ecuatoriana la cana de azucar se la pela;1
hace una semana o dos que no hago ejercicio y hoy sali a hacer algo x mi vida y me mare este cuerpo inutil que no me sirve de nada;1
que es y que puedes hacer para evitar el sim swaping;1
no es nada dificil y si se torna algo complicado me lo quito y me sueno la nariz jaja;1
sigue creyendo el cuento que se quiere ir al contrario;1
no es por la explotacion no es porque causa diabetes es por las groserias que hacen vibrar en una frecuencia mas baja que quien sabe que signifique eso pero si me hizo reir que onda con la banda ;1
pokemon al final no eres tan inutil felicidades matao;1
homicidio en santa ana los tres policias solicitaron la excarcelacion al juez de la causa;1
 no les causa ruido que algunos de los jueces en programas de canto no ganarian ni de lejos un concurso de esos y que tienen alumnos que cantan mil veces mejor que los profesores claro yo se que es tambien la experiencia que tienen pero no se;1
fue un buena noche;1
le siguio pues no tardo en ordenar sus pensamientos e intuir lo que podria estar agitando el animo de su esposo mi vida por favor no te atormentes a causa de algo que no pasa de ser una posibilidad;1
ano colegio la reparacion miraflores reparadoras del sagrado corazon este llavero de acrilico un gran recuerdo;1
aqui va boy with luv feat halsey de twt;1
desesperada abuela clama ayuda para su nieta quien padece cancer pide apoyo para la compra de regeneradores de celulas para que su nieta pueda soportar quimioterapias si desea apoyar la causa comunicarse al ;1
cuando faltan el respeto al himno argentina;1
se comunica que jaime va convocar a un adelanto de erecciones ya que hace tiempo que no la ve;4
una paja en tu nombre porque estas riquisima;4
tbolivia en ventura mall santa cruz bolivia;1
pense que marquitos ya se habia deshecho de todos por que no se buscan un empleo honesto porque como que da penita ademas de ridiculo es inutil;2
voluntarios de balich que participaron en los eventos de los para y panamericanos fueron impedidos de ingresar al evento que se viene realizando en el estadio de la unmsm;1
av el sol con paseo de la republica altura grifo repsol;1
p no considero golpe;1
taco mau volador from cuba leo fre yo cuando tenia u fui radioaficionado osea finales de los hoy radio marti es inutil yo tengo un radio de onda corta moderno;1
el internet no me nuestra algunas imagenes que quiero ver;1
llora en posicion fetal;1
y siguen las miradas;1
tanta hipocresia me causa indigestion vuelvo al rato;1
reacciones;1
extrano que me diga ltven gt;1
chato prada acompano a su hija al altar;1
 la nueva era batacazo en el circuito femenino premio al esfuerzo de bianca cosa de locos;1
hola amigos;1
kien es jbc;1
acaba de publicar una foto en hotel paracas;1
fin de semana para disfrutar en grupo luego a determinada hora llega anfitrion participativo versatil fitnes atractivo buen culo y arrecho toda info x whatsap ;4
 hace historia hoy en la final de felicitaciones campeona ;1
caso maldonado reabrieron la causa para investigar un posible abandono de persona;1
caviedes descansan en la causa mapuche en vez de seguir el ejemplo de los aymaras aprendan de los aymaras mapuches ellos los aventajan;1
 te presenta lo que hace un pueblo cuando este decide asumir una causa el de octubre mira hoy el multiuso leo tavarez de la altagracia llenos capacidad en apoyo al dr;1
si pero si hablamos de la causa;1
mateo existe algo que se llama madurar;2
bianca vanesa andrescu mama papa soy la campeona del gracias;1
r e c h a z o;1
mi intencion no es asustarte por mirarte mas de lo normal pero debo apresurarme porque tu te vas y no me voy a perdonar si conocerte fue una causa perdida y si no te vuelvo a encontrar sera por mala suerte;1
jamas me caiste y jamas me caeras;2
soy tan mala amiga que por el frio cancele la perreada;1
la misma dama que indico que al periodista gorriti nadie lo secuestro se fue a tomar cafe al pentagonito;1
antes jugaban asi;1
bella siempre esperandome en casa en chaclacayo lima peru;1
kiko defiende tanto a sofia como defendia a gloria camila pero no por amor como esta quedando claro sino por interes porque este inutil es la version cateta para telecirco de un gigolo;2
algunos malos policias viven de la delincuencia saben quienes matan y roban pero no hacen nada porque viven de eso espero que la cambie a todos esos malos elementos;2
tras la reapertura de la causa de santiago maldonado es una pequena victoria;1
las autoridades de salud de han informado la muerte de al menos personas a causa del uso de;1
que tengan un magnifico fin de semana no importa de donde vienes ni cual es tu origen tener suenos y metas es todo lo que importa vamos jhon huaman ;1
un buen dia en restaurant oriental kuo wha;1
que bonito es tener un novi que no sea toxic qur no te pida el celular ni explicaciones por saliste con tu amig s etc no me a pasado pero debe ser bonito ;1
que vende humo lenin;2
que resentidos pero asi son;2
con todo respeto amiga danilo anderson fue el fiscal de esa causa y andaba detras de algo gordo pero tambien cayo en los tentaculos del soborno;1
caradededo que pena el estado de negacion en el que te sumerges para negar la realidad considerando que con todo el plan de marketing desplegado la marcha antisistema antidemocracia no convoco ni a mil personas fue un rotundo fracaso ;1
y es que el que vuelvas no me causa ilusion;1
yo llorando cuando mi hermanito hace cosas por mi;1
maridaje del dia aged pale petrus con pollo al cilindro;1
esos momentos de mierda cuando por error encuentras correos hermosos de tiempos perfectos;1
voy a buscarla para ver que tan inutil es;2
esto me recuerda la anecdota real de un accidentado trasladado en una ambulancia que sufre un choque que causa nuevas heridas en el trasladado sobre llovido;1
peru que la bartra lo entrene junto a sheput en la pestilencia;1
ver tu comentario me causa tanta risa goles jajaja quiza yo metiera y tu diciendo a ese amanador pecado si no mete goles ese hdp contra ese equipo;2
mientras no exista consciencia alguna de lo que estamos padeciendo por causa de nuestras propias acciones;1
taladro dale anda y putea a julio dario silva noguera cazares sarmiento y demas jugadores que se fueron a causa de esta dirigencia de mierda no entendes que el juicio se hace a la institucion no al nombre peor no sabes que en la demanta tambien esta el nombre de spinoza;2
duque se mostraba independiente de su mentor uribe;1
se le sigue cayendo poco a poco el cabello a causa del agua con brillos que le empezo a rociar no lo nota se fija solamente en que gold lo esta molestando de nuevo podrias parar con eso ya llevas dias haciendolo ninato tonto;2
cosechar toneladas de abundancia es la causa y efecto de hacer el bien cada dia recuerda que siempre recibimos lo que damos;1
sigan con el gran trabajo dr mohar y dra palafox los pacientes seran beneficiados;1
mx a angelina;1
por que el efecto causa efecto;1
tvperu no sera a lo pk pero en el inpe hay como atenderla atenderla;1
un viaje con mi papa;1
fin de semana para disfrutar en grupo luego a determinada hora llega anfitrion participativo versatil cms fitnes atractivo buen culo y arrecho toda info x whatsap ;1
mantilla reafirma que se deben investigar encuestadoras y mensaje a la nacion via peru;1
 macias jugador mexicano le quito el puesto a un jugador extranjero si el esquema del leon es tan bueno entonces porque en la final sin macias el leon se miro tan chato y no metio ningun gol;1
 a que hace refencia el termino pronostico de dispersion de cenizas hoy;1
con la gente del trabajo en restaurant oriental kuo wha;1
cambiate a la inutil;2
 estrellas del universo que iluminan cada rincon del escenario con su presencia cautivador poder y presencia en el escenario por que ellos son brillantes angeles que brillan con su propia luz en el universo;1
cuando el exceso de paja te causa desordenes mentales;4
nunca te cayo bien por sus ideas homosexuales;3
el ms es lejia tomar lejia te causa intoxicacion y muerte segun que plantas tambien pueden intoxicar como los tagetes en sus charlas y escritos critica y se mofa de la gente a esta en su contra incluso se reia de hacienda;1
campeon hermoso ;1
esta es la iglesia mas distante de mi y hoy culminamos con alegria el programa con decisiones al bautismo estamos tonyquispe;1
es real antonio brown con new england me causa mas conflicto que miley cyrus dejando a liam;1
sabado sport en peru;1
no mi amigo se equivoca al burlarse de una mujer qe al final de cuentas defiende una causa buena a nadie agrede;1
me causa mucha ternura este video;1
estoy enamorado;1
fin de semana para disfrutar en grupo luego a determinada hora llega anfitrion participativo versatil cms fitnes atractivo buen culo y arrecho toda info x whatsap ;1
hago extensivo el agradecimiento de cada vecino de tigre por tu visita por tu causa que es la nuestra vinimos a proponer soluciones inteligentes y de fondo a las problematicas olvidadas la politica al servicio de cada vecino;1
romulo si y sin causa y en los cortes q se cren q no tendran mamita;1
tengo una pregunta en el pueblo donde yo vivo siempre que veo un policia me causa tristeza de ver su vestimenta escuche la otra vez que les darian uniformes sera que puedo preguntarle algun policia si es cierto y gravarlo sin que el tenga problemas con la institucion;1
salieron todos los peronistas a defender junto la unica causa de esa banda el enriquecimiento y la impunidad de los tres o cuatro matones a los que van a votar;2
jajaja yo no veo fotitos estuve alli pobre hombre tratando de argumentar lo imposible;1
el verdadero amor es libre;1
que bonito no tener un novi no toxic no me ha pasado pero debe ser bonito;1
hoy vi a un senor con su hija jugando a las munecas en un parque me senti muy feliz por ellos ;1
angelruiz sabes q lo volveras a hacer cierto ;1
una escapada con la mama;1
el estadio olimpico atahualpa coloso del batan vuelve a vivir la preferencia totalmente llena;1
fleischman por eso un chato bueno y habilidoso destacara acompanado de altos que compensen en juego aereo y friccion peru lamentablemente tiene chatos en ataque no lastima a nadie;1
que le bien inutil;1
 cuando hayas de sentenciar;1
me causa mas placer que me salga una guia entera de elementos de analisis matematico que coger ya;1
 el derretimiento del hielo a causa del cambio climatico esta desvelando tesoros arqueologicos impresionantes en perfecto estado de conservacion;1
tarados del maltrato animal;2
la vida pasa en ese instante que decimos mejor otro dia en muelle de pimentel;1
siempre pense la vida debe continuar;1
cobardes desde afuera miami;1
la gran corrupcion es un efecto y no una causa de dejar a los gobiernos libres para hacer lo que quieran y manipular las leyes y el poder;1
residencia villagloria;1
tambien le cae su mermelada;1
posponer es la causa de mis desgracias;1
tiene la estetica de todo lo q le gusta al pero q causa espanto en el resto;1
la gente es inutil;2
como aficionado de la mlb;1
 te presenta lo que hace un pueblo cuando este decide asumir una causa el de octubre mira hoy el multiuso leo tavarez de la altagracia llenos capacidad en apoyo al dr;1
 que tal esta la de elite;1
son hijos de puta pero ademas son cagones como la mayoria de estos abogados que la van de compadritos con los ignorantes pero a quienes puertas adentro los caga a chancletazos la mujer y le chupan la de abajo a una vieja delincuente como la porota cagones;2
otros sintomas de lupus incluyen fatiga y fiebre sin otra causa;1
se manda un huevo tantas vainas importantes que necesita el pais y malgastando el dinero;2
con tu sueldo podriamos comprar muchas mas;1
mientras tanto elon musk ;1
nace una nueva estrella del tenis femenino;1
y lo digo como neurologa como medico y parte integrante en esa prevencion y diagnostico hay trastornos en los que el paciente no es consciente de su enfermedad;1
debes repetir si tu bola golpea a una influencia externa despues de un golpe en el gren si no es desde el gren no antes se llamaba eventualidad del juego y la influencia externa una causa ajena con algunos matices;1
yo ultimamente apuesto por la ultima opcion;1
 que buen mural en wahios barranco;1
que es y que puedes hacer para evitar el sim swaping;1
inutil del todo no es jeje pero recuerdo que el pasword para ver el final del flashback juegazo de la megadrive era cygnus lo use una vez para ver si funcionaba y se me quedo porque me resultaba curioso ;1
chau mierda me voy a fumar;2
tan bajoneado q fui dond mi causa y le pedi un abrazo xd;1
mira que hermoso giro dio la causa el abandono de persona esta mas dirigido a los companeros de santiago maldonado que no hicieron nada ;1
este articulo resume el sufrir de millones de personas en distintas ciudades del a causa del trafico es un problema de salud publica seguridad ocupacional e inclusive financiero porque repercute en perdidas para las empresas;1
ya quiero que sea octubre;1
manuel que la who;1
pais vaper en generico es como si culpas a las cacerolas o a los platos el problema esta en el contenido lumbreras y resulta que esos casos se estan dando en un territorio donde hace poco se ha legalizado el uso de ciertas sustancias ;1
ya me siento rico y siento la abundancia en mi vida;1
no lo hizo porque es un traidor guaido fue desde el dia enemigo de la causa de la liberacion;2
ni cuando estaba en venezuela que tenia un buen empleo;1
contra;1
 me parece o twiter esta censurando la media que adjuntamos cuando se trata de comentarios criticos o sarcasticos contra el gbno o sus guaripoleras ya me paso con un video filmado por mi y con ciertas tomas de pantalla muy raro ;1
eres un autista me das pena;3
esta hablando de este video;1
ash fulop creo que ella no sabe que tambien existen los nights clubs;1
si uno esta a punto de morir debe caer hubiese pasado esto en el peru de seguro estaria presa;1
yo me burlo porque quiero y tu te haces la victima porque eres mujer;3
yo no escucho el programa pero veo tanta peticion que me parece que el enfoque no es al personaje debe ser los auspiciadores si quieren causa y efecto yo se de que saco se saca el mejor traje;1
es resquemor remordimiento resentimiento o disgusto no exteriorizado que causa desazon y que se manifiesta en cierto recelo y desconfianza;1
ya no para elady;1
pero no la hinchada de colo colo es la que causa los problemas;1
bryan adams de chibolo era demasiado churro sos;1
pues mejor veanla y despues opinan;1
feliz con nuestros t shirt de apoya esta causa hermosa zulenymedina;1
cuesta y sobre el texto comentantes una cosa y seguidamente disculpas a dalas pues oye buscar un antiguo twet por ahi para abajo sabiendo o no si te ha disculpado y si no hacerlo tan solo por la buena causa motivo de que vaya a echar una mano cosa que ni ira;1
tal cual;1
karma yo en que mitad estoy;1
sentar cabeza creo ya es hora;1
litle mix aun con su promo de mierda y su equipo inutil y misogino es la mejor de esta decada fucking stan;2
la unidad operacional constitucion de las realizo de control de gasolineras en los cantones y para vigilar que el combustible no sea comercializado en el vecino pais de contrabando;1
algun dia ;1
en blount fue cortado por stelers por indisciplina ne lo trae de nuevo y ese ano regresaron al sb para ganarlo patriot way es un dogma de vida si lo adoptas ganas mucho si no lo adoptas no encajas si no encajas te vas;1
alberto fujimori viejo basura;2
cada vez que veo a alguien en publico tomando gaseosa no se pq me causa rechazo;1
 ecuador;1
que tan inutil tienes que ser;2
talvez seja por causa de agustd kajsjqkakaka;1
no es gay eso lo inventaste tu como insulto a causa de tu homofobia ahora que tienes un que se declara homosexual te vas a hacer el mente abierta jajajajajajaja;3
ya es hora de preguntarse si esta situacion es responsabilidad solamente de trump;2
todo reto causa miedo al principio;1
ya por aqui estamos ready para hacer dos historias al mismo tiempo ra correr estos km apoyando la causa de rd para poder seguir su lucha contra el cancer infantil da correr mi primer;1
sencillamente fabulosa un monologo cargado de humor negro;2
y quien se fia de uno que no se fia de nadie un vendedor de humos no tienes nada sin unidas podemos;2
litle mix aun con su promo de mierda y su equipo inutil y misogino es la mejor banda de esta decada i fucking stan;2
si hubieran mas empresas y ellos tuvieran mas que vender tendrian fondos para salir de vivir en la calle;1
hay que lerlo ;1
esto fue en la calle;1
nos enfocaremos principalmente en los animales que estan en la calle;1
hace un rato volviendo del trabajo he pasado por una calle oscura y un hombre me ha dicho hola guapa;1
un pino de weones ocupando la calle los pacos deberian subirlos a la vereda y luego irse a patrullar no daba para mas;2
buenas tardes solicito para manana un nuevo operativo de control como el realizado el domingo pasado en la calle el tablon y av maldonado referente a los autos mal estacionados favor tomar en cuenta esta solicitud muchas gracias;1
las tardecitas de buenos aires tienen ese que se yo viste salis de tu casa por arenales lo de siempre en la calle y en vos cuando de repente detras de un arbol me aparezco yo;1
 que gracia que garbo como camina la nina bonita por la calle abajo que elegancia que travesura como mira la nina guapa con todo su encanto que sutileza que descaro como embauca la nina bella con su ademan desenfadado que picaresca que locura que enamorado;1
a pin policia en madrid almeida acaba de poner de patitas en la calle a la abogada responsable de presentar el recurso por el caso de la venta de las viviendas de la emvs mario puzo hubiera escrito tomos con estos;1
totalmente de acuerdo debe quedar alguna ciudad en donde la gente duerma en la calle;1
cada persona que encuentro en la calle me dice que estoy mas alto ;1
rt mezinpsuv mervinmaldonado rt adrianpueblo gobierno de calle con mervin maldonado en el municipio libertador sector la milagrosa con el sistema de misiones y grandes misiones trabajando con amor para el pueblo nicolasmaduro mervinmaldonado cona ;1
ya vieron la lilis no se quien le dio permisos a romper la calle pero quedaron intransitable;1
mejor de lo q pense ;1
de calle pa ganar otra vez pte;1
es buena;1
faltan meses para que se acabe esta decada y no se si este ano ha sido el peor o el mejor de mi vida;1
wv la libertad era algo bello llevaba menos de doce horas fuera de las rejas y pensaba que podria acostumbrarse a aquella vida estaba sentado en uno de esos cafes cuyas mesas estaban colocadas en la misma acerca de manera que la calle por la que pasaban montones de vehiculos gt;1
por ese tipo de weones la gente normal no va al estadio y ademas es un cabro chico que con suerte debe saber donde esta y lo que significa colo colo;3
totalmente de acuerdo debe quedar alguna ciudad en donde la gente duerma en la calle;1
un desconocido me acaba de callar en la calle porque no se van a lavar el culo;2
la musica que me gusta ahora;1
me llamas x como te doy xq otro en la calle como yo no hay;1
si te vas m quedo en esta calle sin salida;1
oficial amigo como estas asere;1
un like y salgo a la calle a ver si me cae parte un rayo es bromi solo lo hago por dos;1
video detienen a abuelitos por vender papitas en la calle;1
aun no supero a calle y poche aun estoy temblando gracias son mi vida;1
ni cagando aun no;1
unas ganas de cruzarmelo por la calle y preguntarle si es el mismisimo;1
ema cuando vamos por la calle y cruzamos perros;1
de una;1
una vez que te pasa salis a la calle con otro aire;1
pero era indepe entonces a la calle si eres unionista puedes decir lo que te salga de las narices en tv;1
o sea yo tan bonita lo cambio a javier para salir;1
iba por la calle escuchando tiri tiri de y gritandole a la gente que pasaba que la escuchen porque esta buenisima;1
 empieza con muy poco;1
sopa criolla arroz con pato en siete sopas surquillo;1
 y ustedes suben hacia manzanares en avion me imagino porque la calle guaicaipuro de baruta para subir hacia manzanares totalmente destruida con mas de megahuecos botando agua desde hace mas de mes;1
aqui las gringas andan en cholas shorts o en vestidos realmente horribles y a ellas todo se les ve demasiado bonito uno anda en cholas en la calle o con ese tipo de vestidos y la propia marginal salida de la puna ;3
twt cada uno en diferentes direcciones pero son uno mismo con el universo twt;1
quilmes impactante accidente en las vias una formacion del tren roca embistio a un camion en bernal que quedo atascado en calle las heras el concuctor del camion fue trasladado a un hospital con heridas leves el maquinista del tren tambien tuvo heridas por el impacto;1
estimado juan usted le las respuestas a sus mensajes una cosa es defender los intereses propios pero otra ya es hacer el ridiculo consecutivamente yo diria sin pericia para salvar lo que queda;2
vamos pa la calle la agenda contrapunto ahora camina de sabado a sabado;1
incidente vial entre dos automoviles en la calle con carrera sentido oriente occidente unidad de asignada;1
 c en mi terraza poca gente por la calle pese a ser sabado noche de chaqueta;1
agenda en territorio;1
si yo canto es que la calle bota fuego;1
wv gtera perfectamente visible para el de repente algo llamo poderosamente su atencion del otro lado de la calle un hombre aparco su motocicleta en un espacio entre dos coches y blaine se quedo bastante asombrado al contemplar tan bello vehiculo de repente decidio que gt;1
ahorita me acorde de un nino bello que conoci en venezuela que dios era muy bello y tenia un pipi hermosisimo jajajajaja pero soy mala puta que no me acuerdo su nombre lo recuerdo y me mojo;1
este tipo de marranos me turbo cagan podria jurar que azota las mancuernas en el gym;2
este senor se pone a mitad de calle pino suarez y refugio rodriguez en santa maria la rivera a descargar agua hasta cuando van a reglamentar estas dos calles puebla;1
de susan esto no saldra en los mermemedios;1
esta cancion y el video me encanto concojones ;1
porque el cachillo mierda ese esta en gayumbos en la calle;3
mi gato se ha ido hace dos horas a cazar conejos y no vuelve hoy duerme en la calle;1
toda esa gente que se subio no anda bien;1
cultura y ocio gt menudo sabado intenso hemos tenido en festival de cultura en la calle y las fiestas del barrio pablo iglesias las fiestas de la pablo alguien da mas pues si manana seguimos mira el video ;1
que pedo con esas mujeres que me publican en mis dibujos de instagram yo quiero que me hagas un retrato jiji pero te las topas en la calle o en un bar y no te quieren ni saludar el actuar de ciertas mujeres a veces me saca bien cabron de pedo;3
encontre una lagartija en mi bano dios mio no puedo descansar en paz sabiendo que tengo ese animal raro adentro no quiero matarlo porque me da pena;1
 una anciana en la calle con este tiempo jajajajajajajajaja;1
mi vecina de cre abel pintos con este sabado lluvioso;1
yongiwings twt lo mas valioso que te has encontrado en la calle el amor de mi vida v ja ojala twt;1
como me joden los policias que no dejan laburar a la gente en la calle;2
menciono mucho el tema del ghosting porque se que de alguna u otra forma aun me afecta aunque hayan pasado meses pero aja yo se que ese cono me lo voy a encontrar en la calle y lo voy a patear ok no amigos jajaja;1
hay mas gente en el suburbia que esta cruzando la calle;1
sin dar pica pollo;1
con les companers en la calle militando para que el de octubre terminemos definitivamente con la pesadilla del neoliberalismo y construyamos una patria para tods;1
paracito arrastrado;1
junto a personal de la se ejecutan operativos de control en distintas carreteras del canton para evitar accidentes de transito y controlar la de los pasajeros en la provincia de;1
tengo tan pocas bobs que puedo andar sin bra por la calle agusto;1
fue su culpa para que atraviesa la calle que no sabe que es de uso exclusivo de los coches el simio que maneja de esos que abundan en la calle;2
me pasa al igual que en los rallyes;1
el islam es el unico problema;3
ese momento en el que no sabes que hacer tu vida solo quieres estar con tus amigos con una cerveza en la mano y la risa en la boca y no pesar en nada estoy es ese momento;1
pero si la gracia de beausejour es hacer la banda si vamos a jugar asi pongan a otro cabro que si sepa sacar centros;1
prefiero q hagan cerveza antes q musica;1
que ganas de tomar tequila con cerveza y mandar a la verga el domingo de estudio;1
tiene pinta de agitador socialconfuso;3
tengo piza casera de atun;1
no tome cerveza;1
aveces aunque las cosas cambien;1
armen el gas pimienta lo tiro carabineros;2
piza y cerveza;1
revolucion en plaza bolognesi ;1
mija hermosa y con cerveza en mano;1
cerveza una publicidad tan tibia y espantosa como su intento fallido de cerveza tarados;2
me tomaria toda la cerveza si pudiera pero hoy toca no tomar;1
me gane el descanso en miraflores;1
que cerveza de mierda;2
drinking an ambar by cerveza vargas;1
que nivel de tenis en la final de mujeres en el gran nivel de la nueva campeona de anos canadiense bianca andrescue;1
