tweet;tipo
amo ver a mis clientas disfrutar y divertirse con su maquillaje en specchi;1
como no amar este hermoso club;1
pues si de un huele pedos del fujiaprismo narcoterrorista no esperamos nada bueno;2
sera una noche de emociones suspenso yo estoy que me muerdo las unas por la setencia nonquiero que se vayan vamos con todo y hermosa contigo siempre;1
no sabes lo borracha que estas hasta que vas a mear;1
es una borracha anda atiende a tus hijos oye;2
yo me se hacer la borracha ;1
eligen a hienas de la misma manada martha chavez;2
jajajajajajaja komo lo zupo;1
mi mi historia;1
 gt no lo haria pero mi experiencia en el area me dice que la gente borracha usualmente dice la verdad;1
aqui con kazuma kiryu resolviendole la vida a todo kamurocho;1
lo mas hermoso que veras hoy;1
de acuerdo;1
se viene mi cumpleanos;1
 me parece o la senora que llego borracha al concejo esta cuestionando la disciplina de morris;2
mi mami dice sonrie los brackets son temporales;1
arp no tengo la culpa b yo solo me presente con mi sonrisa de siempre;1
peru que raro si no tuvo corazon con sus padres y hermano;1
toda mi solidaridad contigo la gente insensato e ignorante no tolera una reunion de amigos con cafe saludos;1
tenia idea de todo lo que tuite ayer borracha;1
aviones ;1
kloaca al descubierto;1
senora natasha;1
esta despierta y dandole fav a mis twits de borracha honestly i don t understand;1
sr arrodillado ante montesinos usted vive en los eso de repetir una mentira muchas veces como lo hacia alias presidente y tu amo montesinos ya no funciona eres parte de la pestilencia;2
hay militares honestos y democratas pero tambien los hay aquellos que se someten a la corrupcion y al crimen y hasta firman actas de sujecion te lo recordaremos siempre;1
rural dia paciente refiere calambre en el diente ;1
la vida con un perrito;1
agarralo agarralo agarralo y ;1
dato importante sector norte de loja complejo ferial y alrededores esta totalmente congestionado ;1
mami te invito un tequila pero nos vamos a coger;4
callate borracha chupame la pija;4
eso de que me aburro rapido de una persona creo que si era cierto;1
ya no somos ni amigos;1
meirda no no hice un letrero diciendo fuera odebrecht;2
como piensas progresas cholito si no tienes donde caerte muerto;3
digo esto porque la gente dice que incito a que lo hiciesen con una persona borracha no se que pensar ni sentir;1
adolescente;1
un grande presidente ecuatoriano sobre como se debe tratar a la mayor empresa corruptora en el mundo;1
el finde pasado pude salir a pesar de que sea el cumple de mi hno este finde es el cumpleanos de mi viejo y no hay remate me quedo tendre que escuchar conversaciones de gente vieja borracha mientras robo la coca cola de la heladera;1
ellos son anal listas;1
no deberia estar de madrugada q es como si estuviese borracha y soy extra sinceraxs;1
cumpa el progreso tiene un precio;1
feliz de setiembre a mi;1
cumpa los que vivimos y transitamos tenemos que padecer y sumale que tienen una puerta salen a montones y no usan crucero;1
peru huele a bacalao;1
lo borracha que soy yo el fin pasado jajajajaja hpta;1
 que esperas vota aqui por el cortometraje el lazo una produccion de aprendices e instructores de la regional que participa en apoyalos ;1
huancavelica en huancavelica;1
me los guarde la tentacion me gano su pelito su colita sus dientecitos ;1
yo borracha;1
la misma wea;1
 no quiero una novia borracha uy rey;1
tequila salado;1
recuerdito de mi querido pueblo en tembladera;1
salado bajon me pinto;1
laura borracha me parto el cono;1
estas borracha si;1
amo peru y amo pacasmayo;1
casi todas mis amigas con las que frecuento se han puesto brackets empiezo a pensar que era mejor estudiar odontologia y llevar una especializacion en ortodoncia el dinero que se hubiera hecho;1
al partir de estas mentiras y la poca o nula respuesta del;1
mi amada amiga no te preocupes yo te sigo igual aunque retuites a personajes que yo no seguiria ahora solo una pregunta;1
 en universidad coperativa campus el salado;1
 lojico;1
totalmente valido y el rector ya ofrecio;1
fav si voy a ver si me venden birra en la estacion de servicio rt si andate a dormir borracha del orto;1
jajaja;1
me encanta porq dicen la vi con tal estaba borracha y buscaba a tal ni si quiera salgo gente y cuando salia me iba a lo de mi novio ;1
queda claro que su proyecto politico es transgredir la ley y demoledor el sistema democratico;1
a lo que se es que no le gustaba actuar como borracha y le tiraba mierda a melanie por tw;1
amo pacasmayo;1
todo bien con twiter ;1
yo te pregunto imbecerril con todos los millones que les dan a uds como gratificaciones y compras de canastas navidenas cuantas incubadoras se hubieran comprado payaso mal nacido porque tu saliste de una cloaca;2
 no les pasa que aunque son pasivos y ven a un chico hermoso y de buen culo lo quedan viendo;1
 estas loca;2
te recomiendo al dr vargas te atiende donde sea;1
yo creo que la ciguena se webeo conmigo ;1
 gt frunci el ceno mientras intentaba aclararme el odio no es hacia ti es hacia mi misma conocerte ha hecho que se despierten en mi sentimientos miedos y yo bueno siempre fui feliz de no sentir nada por nadie la vida era mas facil asi;1
cuando lo escribes borracha;1
 por que no estoy ya borracha;1
dios no te ha sacado de egipto y te ha traido a la tierra prometida;1
hoy vamos a cenar piza casera so toy haciendo la masa wish me luck ;1
borracha como siempre;1
las risas q m estoy echando con los audios d andrea borracha uf;1
esto es informar y demas aprendan;1
periodistas morbosos;2
las cosas claras;1
ays valen llego un poquitito tarde al dia de tu cumple pero llego te quiero mucho y lo sabes viva esas amistades a primera vista y gracias a nuestra che que sin querer unio esta amistad tan bonita;1
jajajajaja lol;1
anoche ledije q lindo sos a un chiko jajaja pq tan borracha yo nunca le digo nada a nadie q mepaso tengo una verguenza q virgen soy;1
mi mas sentido pesame mi querida amiga ;1
hoy estaremos en los distritos de engalanando la ceremonia de nuestras princesas muchas gracias por su preferencia ;1
hoy salimos a comer por el cumpleanos de mi hermanita bebe y estoy borracha con una sangria jajajajajajaja que pena twiter;1
los ojitos de gureum su colita su pelito ;1
os acordais cuando estaba borracha e iba corriendo con un bol de cereales y me resbale y se me cayo todo;1
es su hora cachimbos mechense;1
que van a cosechar si no siembran;1
manganzoides talla s para recojo o envio en lima;1
quieres a tu equipo favorito en para ti;1
estoy borracha y no duermo en mi casa;1
soy yo o es que la cosa se esta poniendo muy loca alla afuera;1
es su hora cachimbos mechense;1
soy yo borracha;1
jajaja bridges tal cual en especial borracha pero buena muchacha;1
que pedo si jajajaj;1
 hasta cuando hagamos algo;1
me siento fatalll con una migrana horrible creo q es porque no salgo a tonear hace siglos u u;1
extrano estar borracha;1
puta que lindo lean la historia abran una botella del trago de su preferencia y amen aquellos que los haga diferentes;1
siempre te amare;1
bolivia pasando a temas mas serios alguien puede identificar un bisone en la foto ;1
va a volver;1
mi mejor amiga me ha enviado un audio de seis minutos y medio para decirme que tiene hipo y que hace frio fuera uh alguien esta borracha y no soy yo;1
ro pierden la medalla presidencial do pierden en la chiquitania al presidente el primero era importante al segundo estara que jamas lo encuentren;1
el ano pasado estaba en teror to borracha pidiendo promesas a mi pinito que no se me cumplieron por bollera y este acabo de llegar del hospital porque tenia una pipa vlavada en la garganta como cambia la vida en un ano;1
me la queria comer a riley pero anda mas borracha que mi tio en el quince de mi hermana;1
servicio a causita en royal car wash y autodetailing;1
cuando mis amigos suben historias de fiesta y yo salgo de fondo borracha;1
esa es la nueva actriz especialista en fingir gran teatro desde la carcel;1
con plata;1
veo este tipo de cosas y cada vez me gusta mas lo salado;1
haberle dado y te metia en su armario;1
estoy hablando con los coreanos y el mexicano;1
el templo de las ratas no iria de ningun modo que sabes;1
diganme si habia otra que merecia mas el titulo que bianca cc p sakuraba;1
joda;1
no entiendo por que la tiene que quitarnos las correas al ingresar al estadio como si fueramos deficientes;1
pero sigue borracha ella;1
asi la aguantas tu;1
no me dejen edita foto borracha pli;1
de viaje con las amigas o mas bien;1
cuando ves los mensajes que mandaste la noche a terior borracha;1
 gt de repente se me olvido que estaba borracha abri los ojos aterrada que eh cuando he dicho que estoy enamorada;1
ya tengo ganas para ver a mi distinguida dama para meternos alcohol a la sangre;1
ni tanto;1
 quienes somos creandos que hacemos creando cambio en universidad de lima;1
puro teatro la mafia nunca cambia en ese extremo;1
oye miriam estas borracha;1
 el vidrio templado del celular;1
primera vez que pruebo la piza raul y creo que me enamore ;1
y que mas te da a ti feminazi de meirda;3
doy fe de rodillas en un seto porque o podia mas hace como media hora;1
hay que probarlo borracha;1
si super buena;1
gita poro;1
amen hermana;1
sin miedo;1
bueno yo vivo en el trabajo y suele visitar la casa un rato todo los dias;1
bandera de chicles todavia me queda algo de condicion fisica para poder levantar al chicle bola foto gracias a eli en el festivaldebelen ;1
gracias equipo que rica noche;1
hace una semana estaba borracha y hoy estoy viendo el deluxe;1
asi es que dos hermanos de cecilia valenzuela son comunistas tambien;1
cero;1
borracha pero nuena muchaja;1
vos estabas re gd anoche borracha;1
siempre blanco y negro in bnw;1
entre la borracha esta que me chupe la pija;4
que te quiero borracha y sobria;1
unicentro o el lugar mas salado del planeta;1
me acuerdo que la primera vez que joel me invito a cenar a su casa todavia no eramos novios me pidio que prepare fernet le dije que me pase una jarra;1
si era ratael ahi si el mejor presidente cuanta doble moral diria ese corrupto;1
mayte estas borracha no;1
esto parece otra jodita lo peor es que esta jodita nos gobierna que ganas de mudarme a islandia;1
hora de sumar votos te gustan las aventuras extremas materia que odies fansign o concierto army bomb o album invierno o primavera dulce o salado que cosa tienes a tu derecha twt;1
que buena;1
despues de tomar el licor;1
 pensando sobre el tema;1
necesito que me digais cosas bonitas esroy borracha y triste;1
desde nina me ensenaron que si te lastimas te hechas alcohol para que sane;1
ta borracha hace rato no sabe ya ni lo que dice super loca bien bellaka conmigo quiere venirse ;1
mi madre borracha es mas iconica q yo y mira q es decir ;1
nunca comais dulce y salado a las de la manana;1
huertas olaechea se confirma;1
vamos a tomar una cerveza borracha perdida gracias por tanto amor pa ;1
revolucion tecnologica ;1
todo de gris;1
como jamon serrano;1
por interno;1
acaba de publicar una foto en rio seco;1
caliope imaginate que esa veta amarilla es carne de la madera;1
peden decir hasta el canancio y mostrar datos estadisticos y el pueblo seguira pensando que son obstruccionistas;1
se paso de frio;1
por que me odias oie tkm;1
te hablan sr huachiturro porcelanato;1
que moneda usan actualmente;1
esta noche va estar llena de emociones;1
voy a salir ;1
no porque si te tiras luego no puedes levantarte como para tirarme a mi tramposa;1
nota mental no confiar en nadie;1
y quien lo puso a el y q dice de los titeres de vizcarra;1
los operadores mediaticos y fujitroles de la mafia politica los defenderan aun haciendo el ridiculo saben que si caen los cabecillas de la banda delincuencial caen ellos tambien;1
la materia es toda realidad obejetiva que existe de manera independendiente de la existencia humana esta en constante movimiento y transmformacion;1
caliope aqui uno aprende de todo hasta de maderas ;1
ismael serrano ahora que te encuentro anos hoy es siempre dir via;1
y cual es tu metodo;1
tienes razon;1
ya les dije representa a anabelle y lo hace muy bien;1
que ladills chama;1
hija de lilith de ismael serrano;1
comiendo rico y probando los sour peruanos en el mangos restaurante en mangos restaurante;1
w estadio miguel grau for sport boys vs deportivo municipal in callao;1
deberian no ceder ni un punto en sus examenes deberian publicar las notas de los estudiantes que reclaman para ver que tanto estan aprovechando la universidad;1
la peor parte ya va a pasar falta poquito;1
siempre es el momento para beber;1
por que conaxo veo todo negro;1
 donde te paso eso;1
lbm todas son hermosas gorditas o flaquitas;1
la cagamos en barrio xd;1
ya quiero ver a mi unica y carismatica bella;1
yo me quejo de que casi nunca salgo;1
nunca me habia sentido mas cansada creo galeria el dorado in cercado de lima;1
señora como le dijeron usted solo sirve para llevar papel higienico para la jefa de la organizacion criminal de sm torres;2
chers jajajajaja sh okis ;1
uno de mis fav bacardi;1
noche de cumbia noche de emociones noche de suspenso vamos con todo en peru con mi querida;1
cogiendo xd;1
alguien con quien platicar ando aburrido;1
i m at plaza salaverry in jesus maria;1
la segunda tmb;1
ya paso un ano xf;1
aprista solo para recordarte que estas comparando anos de gobierno de ag con menos de dos anos de gobierno de vizcarra como que la equidad no es tu fuerte ;1
hermosa femenina y complaciente ultima gira en el pais ;1
no tengo ganas de soportar a nadie hoy;1
organizacion criminal te hablan torres;1
ese no puedo me dolio mas a mi que a nadie;1
ecpe todos los presidentes tienen problemas con el congreso ninguno se escondio detras del pueblo ni el figureti de toledo;1
tyler y jena estan esperando un hijo wey mis bebes van a tener un bebe wey soy feliz;1
i m at la iberica in lima;1
ultimos dias en el pais ;1
no se nada de salsa ni de alfajores;1
me puse sensible porque me gritaste pero no senor no;1
ver hachiko como trending topic y no saber si se refiere a la pelicula o a mulder;1
gracias por tu labor social de todo corazon deseo que todos los ninos sean atendidos;1
amigo existos hoy y siempre;1
mi bebe y yo relajados en huanchaco;1
 en vivo javioliveira en;1
lr pe con la justas sabe sumar;1
es algo ya viejo te doy mira que es el triple o bueno ingresa a y deja de ser asalariado de ese puto y asqueroso partido y se libre e independiente;1
y ustedes si fueron competentes en gobierno del corrupto ag;1
siempre torciendo la verdad esta mujer;3
hace hambre;1
pinche puta perra y tramposa madre;2
telegrafo hay que ver que en ecuador no hay justicia los pajaros de alto vuelo estan como di nada usted que dice serrano;3
 ya mando con yapa jaja;1
hoy vine a cato para cuidar a valeria;1
la incertidumbre de la politica comercial se ha disparado a niveles no registrados desde los anos del siglo pasado en rio seco carabayllo;1
hola janet;1
quien es que hizo;1
durmiendo;1
a la y el judicial que hace el para frenar a maleantes reincidentes como el de la noticia los olivos sujeto golpeo a la madre de su hijo en la calle y le arrebato sus pertenencias;2
que alguien invite a ericka a ver it pls;1
comparti con el presidente de colombia;1
amigo existos en todas tus proyectos;1
tan temprano;1
hacemos votos por su salud;1
nose de que hablan pero tengo experiencia que flor es una tramposa;1
no soy argentino pero suscribo todo gracias por ser tan claro;1
respire y conte hasta ;1
no hay nada mas populista que solicitar el adelanto de elecciones en aras de una presunta renovacion de la clase politica ;1
nunca pense decirlo;1
amo como mi mama ya se encarino con cami y tambien le compra comida y golosinas como a lulu ;1
que asco de gente no paso a mayores pero si que ese tipo de gente debe recibir algun tipo de castigo;2
bueno una persona con esos problemas de salud es imposible que pretenda ser presidente del peru que se dedique a cuidarse;3
si pagamos una aplanada de terreno como refineria del pacifico xq no;1
pero pusieron la cancion ;1
hoy despues de mucho tiempo pude ordenar mi cuarto;1
gracias;1
mimosa que sea gardable pero no celosa porque si lo es es porque fue tramposa altisima frase;1
este indio no aprende;3
crei que era la tigresa irma serrano poquito peor es panista guacatela;3
se;1
portella esto es una ofensa ni en la manera de pensar porque por mas que sea rock peruano etc tiene una manera de pensar y comentarios sacado de serie el que se me quedo es no no hay forma alguna de parecido con;1
jajajajaja veo un futuro incierto;1
es tarde para amarnos corazon serrano recuerdo en vivo via;1
esas usan mis alumnos en el frio serrano ;1
matenme por favor;1
de fondo enorme ;1
paso a paso se llega lejos hermano que tu esfuerzo te siga dando mas alegrias;1
malditos polo y cayetana;2
 cambios para pa entran jorge serrano y cesar garcia salen jhamal rodriguez y christian zuniga;1
yo no soy asi jiji;1
linda reunion con bellas amistades merecemos tiempo para nosotras a en el tio parrillero;1
feliz cumpleanos a mi companera de vida feliz y agradecido de poder pasar este dia juntos;1
los zapatos nike del principito me los imagino con un outfit de overol llegando a las fiestas de la begona muy digno yo;1
con mi prima la bere alias veneca en lima;1
jaja si supieras q conoci este tema por julian serrano;1
por que recien estoy viendo ocean s eight;1
que sabado aburrido;1
alonso no iba al manchester city o no se a donde dijeron que iba;1
 bonita noche de sabado guadalupe;1
juntando todas las figuritas;1
te oyio;1
roberto firmino de una vez;1
julian serrano los siguio julian serrano just followed your account ;1
no puedo crer que tenga anos;1
todos estan de lujo asi que agne el mejor el talento esta increible esta bien renida;1
porque esta preso fujimori;1
nervios cuando no llega la novio en parroquia jesus obrero;1
epa sam q buena iniciativa te amas;1
esta respuesta me parte el corazon ;1
son solo manga de delincuentes que salen a dar jugo con sus protestas contra de profesionales del mundo periodistico;2
que mala mana menos mal soy extremo puntual;1
se viene un peliculon;1
 unas papas de jamon serrano estaban rikis rikis pero te asaltan con el precio hdp dejenme engordar;1
hapy bday baby mucha por monton para ti un abrazo;1
muy bien todo mi apoyo a un gran senor periodista r;1
lola indigena no tiene nada de fama;3
que hdp yo lo parto tienes que capturarlo y hacerlo quedar mal ante todo el mundo que sientan asco y verguenza por este hijo de puta;2
eso de ley;1
bien ningun presidente de la region habla asi de forma concreta por la amazonia;1
con su terrible limon no va cherrr;1
estas como para guindarme de ti en un abrazo de oso;1
para pakistan cachemira es su yugular alterar su estatus plantea desafios a la seguridad e integridad de pakistan en rio seco carabayllo;1
al mal tiempo un buen viaje ;1
sr usted dijo q se habia recaudado incluso poco mas de millones de soles en dichos cocteles tiene algo que decir al respecto;1
jajajajajajajajaja;1
muy cierto;1
lo justo diego;1
plena que me empute no hay nada mas asqueroso que un tipo que golpea a una mujer peor sin motivo alguno y ni asi enfermos;2
jajajajajajajajajaja stop;1
quisiera salir;1
tuti donde venden ;1
no se quieren dormir;1
casi ;1
tu bizcochito xd;1
por que siento que en vez de hablar del bonito recuerdo de nosotros en aquella epoca;1
concha tu madre no sabes contar cholo;2
pedro enviame tu numero;1
tramposa jajajaja;1
que rico;1
estaba mas flaco v;1
cuando se ama de verdad no existe el tiempo ;1
interesante que venezuela sea el pais ausente;1
peru gana brasil;1
extranamos mucho a espero que este disfrutando su descanso twt;1
estudiar en un colegio religioso fue castrante y abrumador;1
jovenes valores politicas nos exponen sobre el empoderamiento de la mujer gracias a la asociacion amistad peru china y el instituto que dirige cesar lo y cordina los esperamos este lunes setiembre las pm;1
feliz dia a mi ;1
invitados a las noches de feria con amp en apoyemos los emprendimientos locales;1
hay un bar espanol de tapas a la vuelta de casa que se llama juerga y tengo todas las intenciones de ir a tomar algo ahi algun dia pronto;1
 bendiciones;1
algun alma piadosa que quiera pasarme una sentencia sobre la invalidez juridica del matrimonio o su disolucion ;1
con la familia de la seleccion vamos peru vamos melgar;1
maria camila osorio serrano a la final del us open de tenis;1
es que yo tengo mucha imaginacion nanita;1
para miky torres el congreso es el cielo y los congresistas querubines como si los peruanos no estuviesemos padeciendo a este congreso;1
od la falta dos manos de lija y aceite queda divina;1
jajaja;1
mi bebe y yo esperando el atardecer en huanchaco;1
igual te largas perro;2
fiesta fiesta hoy fiesta y salsa ;1
como pueden ignorar a este ser tan hermoso no lo entiendo si a el lo ignoran a mi que me puede esperar ;1
frio mi causa;1
mi hermana me cuenta que estaban comiendo empanadas en la casa y despues de comer a mi papa se le salio lo siguiente guardenle a hamzeh imposible que no se te arrugue el pecho;1
en mi block se mudo recien una senora emperifollada y acaba de poner esto en el whatsap del edificio;1
me quedo con los de twiter;1
solo queremos que te largues viejo rosquete;3
es una pena como en la ciudad no se respeta nada y este no es minibusero;1
es ahora una tendencia en;1
m no vayas x;1
twt el mariachi twt;1
el viejo reblandecido otra vez eres una verguenza para la tercera edad;2
del senor que pago;1
que no entiendo;1
ya voy camino por el jamon serrano;1
increible felicitaciones pao;1
 min de agonia;1
en el corazon no manda nadie ;1
no puedo mas jaja;1
 en cachiche;1
con la familia de la seleccion vamos peru vamos boys quiero ver otro gol el rugir y vivir chimpun callao saludos cordiales para todos buen sabado para todos y todas buen provecho para todos y todas;1
pucha;1
es ahora una tendencia en;1
esta rica pero hace falta como mas papas es cuestion de gustos;1
veneno que le den y despues que se la metan;4
quiero tomar mi vuelo ahorita mismo;1
este par de delincuentes queriendo meter sus manitas en el proceso que tiene que estar pidiendo babosadas ramazini y el delincuente serrano elias el colmo y ya saldran las ratas;3
una pregunta pedazo de asno;2
estoy jugando memorama con natalia y es una tramposa;2
me entra de todas;1
radiante ;1
 me molo mas el de los serrano;1
como quedo el partido;1
en la sesion de hoy nuevamente surgio el debate por la fecha para elaborar la nomina de candidatos que se enviara al congreso el presidente de la comision felix serrano reflexiona sobre los intereses en torno a la conformacion de las listas;1
me fui al nuevo show de paw patrol y me quede completamentr maravillada;1
sorprende que varsky crea en transfermarket jajaja esa pagina es basura;1
sabes que estas viendo cuando recuerdas que en tus tiempos para llamar al extranjero comprabas tu tarjeta y holaperu ;1
dependera del proposito del ahorro;1
pasion x los colores;1
seguro quiere algo;1
por que tiene que ser asi;1
el poder real;1
 de septiembre;1
we su sonrisa me la imagino cjau amo todo;1
la travesia teatro de lucia in miraflores;1
al principio pense que era una broma pero mis respetos ;1
no dejan de sorprenderme sus comentarios;1
excelente hilo de sobre el impacto positivo en el crecimiento del japon de las guerras norteamericanas en asia oriental;1
lo mas lindo y emotivo que he leido en mucho tiempo gracias valentin por compartir la historia del valiente julio quien debe tener las alas mas hermosas;1
 en villa el salvador ves;1
lo llamaremos jamon serrano;1
jul sera que vige se agarro con el;1
lpm jena te amo sos un sol cjau;1
excursus bueno;1
creo que tiene un primo morocho y lejano llamado ogie;1
las cosas que se cuidan no se tiran de repente;1
 detenidos droga incautada armas blancas decomisadas y otros resultados mas se obtuvieron mediante operativo antidelincuencial ejecutado junto a y en el parque el algarrobo luego de una revision a extranjeros;1
hermosa remodelacion de los camerinos del boys vamos boys ;1
ahora entendemos porque el afan de hacer politica;1
aprista con los dolares que le da susana de la puente odebrecht ya debio pagar sus deudas tributarias no sea conchudo;1
sabes que estas viejo cuando recuerdas que en tus tiempos para llamar al extranjero comprabas tu tarjeta y holaperu ;1
es muy zapaton;1
 seguro que no es un meme a ver aclarame eso por favor;1
dile que puedo lavar su carro;1
hay que matar a los de islam;3
es ahora una tendencia en;1
y si matamos a todos los cabros estos;3
llegar a cusco y subir escaleras compensa todo el ejercicio que no hice durante los ultimos anos;1
si efectivamente es perdida de tiempo investigar si el discurso del fue aprobado o no por el consejo de ministros ya sabemos que todos agachan la cabeza y dicen si seno ;1
a este huevon le pagan cada vez que lo insultan las veces que postea cojudeces no caigamos en su juego;2
mientras tanto;1
 en plaza de armas cusco;1
lo importante aqui es que te largues igual que todos;2
puta todos de son de la misma mermelada;2
de acuerdo contigo;1
y en el fondo se muere por ser blanca y poder ser pituca;3
que mi ex me haya visto y me haya dicho que he engordado un culo si me da risa;1
 ponyo es la mejor version de la sirenita que existe ;1
sobrino tiene ;1
conteste apurada y sin conocerme contesta me llego ;1
mis dos mejores amigos de colegio ya se casaron definitivamente voy por el camino del tio soltero de la familia;1
 no habras sido tu que opinas buen sabado muchachos;1
tengo una gran duda v;1
