tweet;tipo
gustavo martinez de recorrida en el barrio espana;1
eso si;1
se creen que por tener un par mas de seguidores eso les da derecho a ignorar;2
en ua;1
tiene razon;1
segunda andaluza gr jor finalizados ud villaverde ibarburu cf espartinas cf guillena cf la liara bp olivarense at cd albaida cd penaflor camino viejo los palacios cf ;1
barrio de mierda que no paran de sonar las alarmas a cada ratito;2
has de andar en el barrio del mijis y con la leonela serrato a pa amiguitas;1
y esto;1
he vivido toda la vida en barrio me crie en mi villa juana que adoro y en mi villa con querido y el que es de barrio sabra como esta mas del de las jovencitas que se meten en marido a corta edad sin experiencia entonces empiezan hacer diablura donde el hombre no lo aguantara;1
si tan solo aqui ocurriese lo mismo netflix;1
estas tonterias sin importancia las haceis mucho;1
que era;1
 previa de agosto miramar cordon penarol penarol tabare union atletica de agosto ;1
acabo de enterarme de que en kingdom hearts i hay un jefe secreto en una ruta gumi todavia no se casi nada del juego mas alla de la historia y me da entre pena y rabia que ganas tengo de dedicarle doscientas horas y aprendermelo de pe a pa la consola no funciona;1
ni siquiera su abogado se salva;1
hoy fui a ver edificios y basura en las calles argentina es re piola amigo nah mentira aguante el barrio;1
los seguidores de migue viajamos a nuestras fincas los fines de semana;1
y su con y de mi tierra en pintobamba grande quillabamba;1
para los autoridades d y hay un problema muy grande salubridad en el sector del cacique del barrio palmarito en barahona;1
se paso al otro barrio colgo los tenis se petateo se enfrio descendio al mictlan si son ligeramente pretenciosos;1
crean platos biodegradables a base de hojas de platano;1
el remix de las canciones de grease es un clasico que no falta en ninguna discomobil de pueblo barrio y que todo el mundo chilla cuando suena;1
pena zona norte ;1
alguien me puede decir que chucha significa sco pa tu mana;1
 en barrio bosques;1
el informe de lopez obrador transito por la misma ruta que el de felipe calderon y enrique pena nieto hoy escribo;1
totalmente ademas;1
che palazo sos boton;1
sentencian a cadena perpetua a violador que libero hinostroza;1
eso me pasa por vivir en un barrio de mierda;2
pasaron los dias establecidos por ley y la no cumple con publicar los mas de seguros obligatorios existentes en nuestro pais ni siquiera responde solicitud peru pe;1
definitivamente bogota esta atrasada y en el completo subdesarrollo por sus decisiones electorales de mierda;2
 gano y avanzo;1
 para mi guillermo fue mas que valdez;1
talento de barrio grr;1
va para todos ustedes hijos de puta extremistas de centro;2
para bva peru crecera solo el peru habia reajustado a su proyeccion de crecimiento el tiene elementos para considerar que ese reajuste no es suficiente y redujo su proyeccion de crecimiento de peru a via peru;1
pero por dios quien es el descerebrado que paga por quedarse unas protesis mamarias de otra persona;2
no lloro solo por llorar daria la vida entera;1
fujimorismo sabotea proyecto que promueve medicinas genericas;1
el de lopez;1
c ni huilca ni glave bye bye se vienen nuevos aires sangre nueva adios mafia fujiaprista que tu defiendes apasionadamente;1
paco pena tambien conocido como paco cubata pena pregunten en la zona centro de albacete ;1
podre salir del ocho ;1
v i c t i m i z a c i o n v i c t i m i z a c i o n v i c t i m i z a c i o n v i c t i m i z a c i o n v i c t i m i z a c i o n v i c t i m i z a c i o n v i c t i m i z a c i o n v i c t i m i z a c i o n v i c t i m i z a c i o n;1
jovenes que frustraron asalto no pagaran inscripcion para postular a la policia via;1
jajajajajaja callate que decis;1
jonathan segura metio un golpe en la cara a carlos neuman sin balon y el arbitro amonesto con tarjeta amarilla fue amonestado;1
y quien carajos estaba hablando contigo cuando te has metido en la conversacion de gente que ni conoces;2
grande dia ;1
pe pero en realidad no se que es lo que siento;1
i m at to barrio in luque;1
roban;1
este viejito no quiere soltar la mamadera necesita para sus panales;2
opecu peruanos habrian pagado s mlls de mas por sobreprecios de repsol y petro peru;1
dirigido a profesionales ligados con las areas de prevencion de riesgos laborales seguridad industrial salud ocupacional operaciones de la industria consultores provedores de servicios especializacion inicio octubre ;1
patricia pereyra y claudio eran los cantante y en tocadiscos a silvio y pablo los guaraguao y la guerrillera solian sonar bajo el limoncillo euclides y lidio hablaban sin parar tertulias y penas;1
espanol multitudinaria ja ja ja ja ja ja su corresponsal en el peru esta dandoles informacion trucha;1
un joven de anos fue detenido este mediodia en san juan al llevaba consigo tres panes compactos enteros y dos panes fraccionados en trozos con un peso total de gramos y mil pesos de dinero en efectivo;1
finalizada la tarde deportiva en el italo composto de villa alemana triunfo de union penablanca sobre renaca alto en sub los adultos dividieron puntos en un vibrante ;1
el zurdo de la cupula del barrio colon ;1
con las capturas y busqueda de personas de la red de pornografia infantil;1
eso es opinion suya zorra;2
nunca mejor dicho mi querida patricia;1
serrano de mierda ;3
ame aunque omar debio dejar a ander como pudo ser capaz de mantenerle el secreto de polo a guzman i cant;1
alineando esfuerzos con nuestros cordinadores de sectores bicentenario i i i iv y v miguel pena es ec ec es venezuela;1
a los barrio norte ;1
 gogle maps permite recorrer los escenarios de juego de tronos;1
manana inicia proceso penal contra pedro chavarry;1
 estoy participando por grandes premios en qolqe;1
en conclusion la gente es una mierda;2
parce donde anda en que barrio vive;1
pero que se piensa la pena que son los informes;1
cadena de muerte para estos engendros enfermos psicopatas ;2
una tarde mas en rodriguez pena;1
se va cagar de hambre si no levantan un centro como la gente;2
mtc precio de los combustibles sera tratado en comision de alto nivel;1
mira que hay pena en el mundo pero en tw ya es que da pereza hasta meterse;1
en un rato tengo que ir al barrio de cari;1
universal mx mas muertos en tu mandato le vas ganando a pena nieto;1
seguimos recorriendo los barrios de lanus en esta oportunidad;1
un cura rescata perritos callejeros y promueve la adopcion en misa;1
un chiste la pichanga culia;1
muy buenos resultados de barrio olimpico y lavalleja fc por a y b otro pasito mas de los clubes minuanos ;1
piden colocar octogonos de advertencia durante etapa del gileo para evitar danos futuros;1
total;1
a lo barrio norte;1
las palabras de apertura las ofrecio la ministra de agricultura urbana gabriela pena quien estuvo acompanada por el diputado de la asamblea constituyente rafael argoti y harold ramos responsable por la alcaldia de caracas;1
no se si lo de este jugador es verdad o no;1
como las fases de la luna alteran nuestro comportamiento y afectan nuestra salud mental via peru;1
rios ese ha sido uno de tantos objetivos que se pretende erradicar con la contabilidad electronica como usted sabe ha sido un proceso largo que va mas alla del sexenio de pena abarca el de calderon no sea excluyente;1
pero la concha de tu madre cierra la boca que esta jugando enzo pe;2
las guerreras jugamos en cordoba y vos podes venir a pasar un dia a pleno futbol estaremos jugando manana de septiembre en el club municipalidad de cordoba calle avellaneda barrio alta cordoba la ;1
primero el barrio;1
si no abre plan;1
este es el bajo nivel de los padres de la patria miente con descaro sobre no haber votado y luego indica que se confundio no sabe si quiere por que vota por eso;1
a la gente que tienes cerca la tratas mas y hay mas posibilidad de roces;1
desde cartagena barrio la candelaria apoyando a los yankes;1
el memo se merece un equipo de verdad no un manoseo de jugadorcitos como penarol siglo;2
muchas gracias a adriana abuchaibe que nos presento a sus amigos en el barrio abajo para hablarles del trabajo que hemos hecho en la asamblea han sido anos de labor continua que han tenido recompensa por eso;1
 estoy participando por grandes premios en qolqe;1
peru celebrara el dia del aji mostrando las variedades que se cultivan a nivel nacional;1
vamos a barrio ctmre;1
bog si no estoy mal la ubicacion es en el barrio villa del rio la cual al girar a la izquierda se toma la av villavicencio que a su vez conecta con la autopista sur;1
se llevaron los manuales los gandallas compinches de pena;1
en colegio carmelitas miraflores;1
 cuando se sabran los resultados oficiales;1
tratamos de objetos a las mujeres asi estamos en esta sociedad disfruten no es lo peor del mundo que tu amigo se coma a tu novia;1
seok pe pero si sos un solecito;1
irresponsabilidad de penalosa hasta del clima es responsable la decision del fue de muchisimas personas gobiernos entidades nacionales e internacionales y anos de espera;1
cuando te digan que los pibes de los barrios no pueden contales que en cada barrio de santa fe hay pibes y pibas como el talento brota y hay que estimularlo;1
pichangas del barrio ;1
es increible la cantidad de cosas que me han pasado esta semana;1
se hacen los propios y no saben lo que tienen jajajajajaja de marindia voy a parque pa esas plaza magiante igual voy a todas las plazas porque en mi barrio solo tenes las esquinas o la garita;1
me paso con breaking bad;1
no soy perfecto;1
a esta chavala la veo mas cantando que hablando con la pena;1
metropolitano hoy hs en union atletica ua en tabare si gana penarol clasifica a semi lo mismo con union atletica pero si caen hay partido definitivo;1
miguel perez arroyo;1
desde de la parroquia union base de misiones de la pena nuestro jefe politico de iribarren;1
favor su ayuda;1
bachata wilman pena recuerdame visitenos;1
que sustento tecnico y financiero tiene el metro elevado que quiere firmar penalosa es horrible la division pero no es aceptable una candidatura de sectores alternativos que solo esta a la expectativa de si penalosa deja o no firmado el metro elevado para actuar;1
ahora que puedo;1
dejamos tranquilo a en su hospedaje gracias a la senora isabel por cuidar de el si hubieran mas hospedajes tendriamos menos problemas con los rescates si deseas ayudar piensa seriamente en necesitamos el apoyo de ustedes para seguir ;1
 y lo ha conseguido en este dia estaba algo mas sensible por lo que ha vuelto a abrazarle grrrr por esta vez has ganado pe rri to;1
desde descubre de gogle;1
 por que si tiene hartos fans;1
esta hermosa mata adorna el frente de mi casa en el barrio san marcos;1
pena en pena de bernal;1
dg vuelve a tu sarcofago nomas;1
por eso la desesperacion;1
cuando no estas en un agite y los son solo una parte de lo lindo de militar con;1
el profe hace tiempo que no esta en penarol tenes menos futbol que aire fm;1
 reyes de la peninsula ramiro i el grande;1
abogada informo que la proxima semana se conoceran los resultados de los analisis de la lideresa de fp;1
este es mi claudio;1
gracias por venir a recoger la maleta yulai jeje;1
no creo que ud diria lo mismo si el deudor se llamara enrique penalosa o galan o claudia lopez;1
porque esto es uruguay pa pa;1
no puede ser es requisito indispensable ser delincuente para ser parte de fuerza popular o agrupaciones de los fujimori increible via;2
y batalla mas malo que el paco que venden en dicho barrio;1
asi el intendente con el q antes era opositor hasta en forma de pensar lewin a cargo de deportes derrocha dinero haciendo proselitismo en clubes de barrio de todo lomas en lugar de mejorar los clubes como techar algunos;1
calle arista del barrio de analco;1
no imaginaba una vida sin ella y aqui estoy haciendo una vida con cosas que no imaginaba hacer;1
asi son los penetrantes retratos femeninos del ucraniano paul fishar;1
el homenaje desde nuestra pena a esos sufridores cadistas q dicen q no defienden a pina pero mueren con pina;1
se van ya fuiste trollita de pena;1
sbs elevo el monto maximo de cobertura del fondo de seguro de depositos via;1
borrego;1
 la junta de vecinos de mi barrio ha convocado mas gente que su marcha ridicula ;1
lo mejor de la historica victoria para andrescu la juvenil canadiense dio el gran golpe ante la legendaria serena williams y se llevo el us open;1
petro gano la alcaldia porque santos no dejo que sus contrincantes parody galan y luna se unieran a penalosa r antes de eso el acuerdo entre petro y santos era un hecho;1
basquetbol en poco mas de minutos comienza el partido;1
hermosas vistas tiene tu barrio;1
el concejal y la bancada del polo han tomado acciones juridicas en busca de detener el proyecto;1
paco amoroso more like octa cuando tenia ;1
los chismes de lavadero y la inseguridad le vale;1
aca en barrio fademac;1
pemex revelo que el huachicol mantiene los mismos niveles que en el gobierno de pena nieto;1
hermanitos cieneguilla;1
jajajajajajaja;1
c h i l e al m u n d o palmas de penaflor via;1
ya es un lobo feliz mueve su cola de nuevo y dejo de agachar sus orejas corresponde el abrazo siempre gano no soy un perrito grr;1
alies dialecto de medehollin tipicos hijos del barrio antioquia el sicariato verbal en todo su esplendor;1
suficiente consultas al email keytato gmail com;1
no solo y deben ser desterrados de la sociedad y la politica peruana sino ademas sus peones y fujitroles;2
se jodieron;1
yo sali del barrio y el barrio me convirtio en guerrero;1
es falso que la oms recomiende vivir con una dieta sin ningun tipo de carne;1
de verdad que lo flipo con la pena es que como pueden hacer algo asi y quedarse tan a gusto encima publicarlo como si nada y sentirse orgulloso a eso obviamente le falta todavia mucho queso;1
hoy en la feria de barrio frente de todos repartio boletas vayamos a hablar con la gente;1
hay joda en mi barrio hoy y adivinen quien no va a ir por estar laburando;1
mi gripe;1
penarol definio que no se vendieran entradas acaban de decir en el ano que viene vayan a venderle la tarjeta de campeon de america a la concha su hermana dirigentes de leche no sirven para nada mediocres y cagones;2
salio a buscar a una mama para reventarse;1
sanch s e o fel pe;1
doe mira no soy ni vegano ni vegetarino;1
el chelo sale a correr con shorcito de boca como toda persona de bien;1
junto a raquel esparza pena paseando y disfrutando ;1
y salir con dos ;1
porque todos los tuits sobre son en ingles;1
el inra debe desaparecer y las tierras entregadas a las regiones de lo contrario pasara lo que esta pasando;1
el josico viendo un wither en su pena;1
o sino yambien lo podes encontrar corriendolo de atras a de la cruz;1
q yuta culiadasa se canso de patiar puertas;1
ivan duque el peon del ajedrez gringo contra venezuela ;1
amlo pide a delincuentes que recapaciten y piensen en sus familias;1
los asesinados son los exguerrilleros milton urrutia mora y jose milton pena pineda;1
me paso con breaking bad;1
 trescientos pe unos tampones de mierda chabon;1
lina de lima la historia detras de la pelicula chilena protagonizada por magaly solier estrenada en net estara en salas chilenas en noviembre a traves de peru;1
la vida es mas bonita cuando los suenos se hacen realidad hace unos meses nos juntamos con mujeres de mi barrio la voz de la mujer amp y aqui estamos las voluntarias haciendo talleres de radio para mujeres que alfabetizan en bosa ;1
mi vecino pone los manseros para todo el barrio y a mi ya me dio alta sed;1
llevandolo por el camino de la makilogia en nori;1
este tuit aplica para el cine del real plaza en la ciudad de chiclayo;1
delincuentes intentaron alcanzar a su victima pero logro ingresar a su vivienda salvandose del asalto;1
desalojaron a vendededores ambulantes con gas pimienta la policia de la ciudad hizo otra redada contra senegaleses en el barrio de flores via;1
vamos union desde san martin santa marta esperando el debut de jermein pena sopla ciclon;1
f p partido integrado de zorrinos;1
frita o en estofado;1
y segun los chavistas nace en algun barrio de petare estan a mano;1
delincuentes intentaron alcanzar a su victima pero logro ingresar a su vivienda salvandose del asalto;1
me encanta ver el mismo comentario introductorio tipo cebo en todas las reviews de it flota o se hunde esta segunda parte ademas de antioriginales sois un penazo con los extremos para valorar todas la pelis las cosas no son o cansinos;1
maria grande ya esta lista para la fiesta pena boquenses de concordia presente junto alos amigos hoy en su noche de aniversario explota la azul y amarilla;1
se necesita personal para industria plastica;1
con mi ma y la cusha huamachuco junin peru;1
jajaja recurrir a un jugador que no esta en tu equipo tambien resulta fracasado;2
pues muy mal;1
golpismo puede generar crisis social;1
pm en mi barrio solo venden plata verde y rosa uwu;1
oficial pues soy de los que pienso que nuestro estadio ahora mismo es una ganga para los rivales como las penas no tiren de los aficionados y los aficionados del equipo pero bueno solo es una opinion personal;1
por favor en el parque del barrio union popular en el sur de quito;1
a y una cachetada en el barrio que clau tambien es una desterrada como nosotras;2
exacto perdiste;1
el cadete canta les ganamos o nada;1
quien es el tipejo;2
se veia guapo limpio y olia delicioso;1
na ape la pende cosquin;1
feliz sabado manizales esta noche nos vemos con mi musica en vivo p m cra av santander tributo a cerati y calamaro barrio estrella detras del multicentro cra a spotify youtube itunes allex henao;1
exacto lopez a hecho todo bien por eso el crecimiento o mas bien por eso es que no caimos en recesion no crecimos nada pero no hemos disminuido a pesar que dijo que iba a a ser al reves y por eso pena esta en la carcel espera un segundo;1
a pesar que otros lo lloren;1
jimena sanchez y johana pena ;1
cafecito cafe haiti in miraflores;1
estas imagenes le duelen tanto a la chairisa que en su mente aplican el efecto mandela;1
delincuentes intentaron alcanzar a su victima pero logro ingresar a su vivienda salvandose del asalto;1
vizcarra hdp;2
esto si estuvo genial ;1
que te llegue la gente estupida cojer a la gente que te cae bien y a disfrutar de la vida en pocas palabras hakuna matata;2
los periodicazos de la revista proceso echaron por tierra los planes de fox de aduenarse del mar de california ya tenia la tierra y marinas en proyecto desde cabo pulmo hasta puerto penasco estaban en la polla los gobernadores de sonora sinaloa y bc todo se les vino abajo;1
una persona golpeada en un choque entre un taxi y un auto;1
muchas gracias armies que se acercaron hoy para dar su aporte al proyecto fue un gusto conocerlas proximo encuentro sab abasto y dom barrio chino guardando la identidad de quienes no querian mostrar su rostro twt;1
video donde individuo penetra a una vivienda en el barrio juan pablo duarte;1
a pesar de esa accion cobarde el local se inauguro una fiesta de barrio de militancia de esfuerzo y colaboracion que sale a construir la esperanza una nueva casa frenteamplista del pueblo y para el pueblo conciencia organizacion y lucha ;1
ahora nosotros apestamos a tabaco;1
en el congreso paloma valencia;1
delincuentes intentaron alcanzar a su victima pero logro ingresar a su vivienda salvandose del asalto;1
los unicos que no se dan cuenta de su propia incoherencia son claudia lopez y el polo moir quienes antes le hacian oposicion a penalosa;1
delincuentes intentaron alcanzar a su victima pero logro ingresar a su vivienda salvandose del asalto;1
esta t y el gobierno de amlo va por buen camino si consideramos lo siguiente zedillo lo dejo a pesos el litro de gasolina fox lo dejo a pesos calderon lo dejo a pesos pena lo dejo a pesos en lo que va del sexenio no a subido ni un solo centavo;1
durante toda mi infancia jugue con mis vecinos del barrio hasta el dia de hoy sigo viviendo en la misma casa;1
yo ni siquiera quiero imaginar el tamano de las cacas que hacia la mentada paloma imaginen el peso que lleva el avion demas ahora sumenle el peso de toda la familia de pena nieto y de toda la comitiva que los acompanaba es literal un avion de mierda;2
simplemente desaparecieron para pasar a vivir en edificios sin lugar el contexto de las cosas cambio por eso sueno con plazas en cada barrio donde pueda generarse espacios de encuentro entre los vecinos y donde existan espacios para que los ninos disfruten de la naturaleza;1
los tibios son tan falsos;2
y la ostra del dia vienes gracias a este sujeto;1
 imaginense ni que se rasurara cada media hora ;1
eres otra nota lok pe gordita;1
en mi barrio solo entra quien yo diga;1
 y no se supone que el precio de la gasolina no subiria como resultado de la reforma penista te desgarras las ropas por el aumento de unos centavos en meses cuando de enero del a agosto del ano y medio aumento de a pesos te quejaste;1
 urgente mas evidencias del acoso policial de hoy sept la policia de mantiene rodeados al politico de la entre otros en el barrio villa libertad managua;1
culpa de mi familia ;1
el dia de hoy estuvimos haciendo corte de pelo solidario y gratuito en merendero la lunita en barrio altos verdes de maximo paz;1
trujillo nino de anos lleva dias desaparecido;1
con amigos salesianos coperadores en fatima barrio kami;1
hoy;1
mi esposa hermosa con mi pequena luisa elizabeth collita tenia que ser;1
tener que esperar el bondi en un barrio donde las cuadras son oscuras es lo peor;1
hay xd q comparacion tan absurda;1
tengo ganas de una piza hawaiana;1
fallece el teniente gobernador de la capilla en accidente vehicular;1
con papas o ensalada por cierto llego la tobillera;1
pero esto donde lo han montado en las zonas bien en mi barrio la parte donde estan los pinchos era para apoyar los pies y los litros;1
hasta el ano lo van a desaparecer de ese dog;1
sanchez tenia que salir asi sea para que entrara penaloza jajaja que nivel tan pesimo el james;1
y cuando uno pensaba que lo vio todo ahora los hinchas de los grandes se pelean por que equipo tuvo mas jugadores gays en su historia deci que te amo penarol porque sino ya me estaria haciendo socio de racing;1
la pena lo tiene q estar flipando jajajajajajajajajaja;1
por supuesto que hay conversaciones secretas tu que cres;1
seguro vino a ver si pe ca alguito;1
debo avanzar algo pero estoy hace dos horas hueving se que faltando un hora antes del deadline me voy a inspirar csm;1
yo le pongo like a mis post;1
del mal vaya eso no sabia gracias;1
hoy toca el barrio ;1
sabado relax con el cachorro en barrio yungay;1
jaja amargo no sabes ni cuando juega tu equipo por eso no tenes barrio;1
la musica quita del alma el polvo de la vida diaria;1
judas hablando de traicion;1
poco se habla del nuevo fichaje de penarol jajajaja ahora esta comodo en su casa;1
lidya cacho bienvenida y excelente periodista ella si perseguida por su profesionalismo tu ni vuelvas oportunista por que no demandaste al gobierno cuando estaba pena te obligaron a verte con un narcotraficate no verdad;2
calle genova estas bailando en el barrio mas rico de madrid y si lo unico que ves es una bebida hermosa de un pais colonizado hasta la medula debe ser amor;1
monteroj que vuelva la urraca;1
it capitulo ;1
peru tambien el sur;1
sedapal implementara redes de control y cobrara por el uso de agua subterranea via;1
escandalo aparecieron los bolsos de plata negra de marcos pena info;1
vaya este mensaje video para la bertha maria deleon;1
se perdio en barrio los laureles anoche no se como salio del departamento pero ya no esta aca;1
c h i l e al m u n d o palmas de penaflor via;1
como siempre;1
hoy en el barrio mientras le ataba los cordones a una nena me corria el pelo de la cara y le dije algo asi como que me mire el grano q tenia que es gigante y ella me dice ay pero si es re tikitito tkm almita pero el grano es mas grande que mi cabeza;1
christian dominguez habria intentado convencer a karla tarazona de no grabar el evdlv;1
tacna futuro del exgobernador omar jimenez se decidira el de setiembre;1
que lastima q este mal;1
siempre;1
el partido entre islandia y moldavia era mas serio que la pichanga ordinaria en el monumental;1
en el barrio quinta paredes encontre personas maravillosas que son quienes me llenan de mas animo para seguir luchando por llegar al concejo de bogota de manera honesta y austera estamos cansados de los mismos de siempre;1
ortiz el barrio pa ti;1
doe sin capitalismo tambien se podria hacer esos videos genio y no el capitalismo no es malo lo malo es la gente que lleva al extremo ese capitalismo del cual muchos vergonzosamente se enorgullecen los extremos son los malos de derecha o de izquierda;1
gobernador macrista sorteo cajas de comida y mantas en barrio humilde correntino;1
me olvide de comprar la anticipada para la pena y aumentan a el lunes;1
voy a intentar no twitear mas;1
la comisaria de mi barrio esta tan linda que me dan ganas hasta de caer preso;1
siete policias integraban banda de asaltantes de carreteras;1
ojala candidata que no se quede sin gasolina a mitad de camino que lo que se prometa se cumpla aunque no soy de bogota quiero ver que la capital tenga otra cara por favor con toda;1
que tragedia para la derecha pasar del que tanto falsearon;1
en la misma linea segun un informe de y la autopercepcion ideologica de los parlamentarios electos de y de muestra una gran cercania informe congreso visible encuesta a congresistas electos ;1
lo bueno de trabajar en lugares de veraneo eterno es que por el barrio no queda nadie cuando hay sol dow town miami;1
la carita de ella cuando el hacia el ruidito de pajaro basta quiero llorar;1
con una besada protestaron por la supuesta discriminacion en un bar de barrio sur;1
